{
  "schemaVersion": "locale-architecture-detection-v1",
  "locale": "en",
  "head": {
    "eyebrow": "02 · How it detects",
    "title": "Every detector answers the same question: how sure, and why?",
    "lede": "There are exactly five kinds of why, and they are ranked. Most of what follows comes from that ranking."
  },
  "theLadder": {
    "eyebrow": "The ladder",
    "title": "Five tiers of evidence",
    "lede": [
      "Each detector stamps its find with one of these. It is a ",
      {
        "b": "closed list"
      },
      ": nothing invents a sixth rung, and nothing promotes itself."
    ],
    "rungs": [
      {
        "title": "It announces itself",
        "sub": [
          "Everything between the opening and closing banners. The only tier whose default action is ",
          {
            "b": "block"
          },
          "."
        ]
      },
      {
        "title": "A company stamps its keys",
        "sub": "A literal prefix, a fixed alphabet, a known length."
      },
      {
        "title": "It has a shape of its own",
        "sub": "A grammar no vendor owns: headers, URLs, JWTs."
      },
      {
        "title": "Something called it a secret",
        "sub": "A credential-ish name, then a random-ish value."
      },
      {
        "title": "Just looks random",
        "sub": "Never enough on its own. A supporting signal only."
      }
    ],
    "axis": [
      "↑ More certain",
      "Weakest ↓"
    ]
  },
  "tier4": {
    "eyebrow": "Tier 4",
    "title": "A prefix, an alphabet, a length",
    "lede": [
      {
        "b": [
          {
            "var": "providers"
          },
          " providers, ",
          {
            "var": "families"
          },
          " credential families"
        ]
      },
      " stamp their keys with a recognisable opening. Every one of those detectors has the same four-part shape, and the whole tier is written in this small language."
    ],
    "parts": [
      {
        "desc": "one literal string"
      },
      {
        "desc": [
          "one of ",
          {
            "var": "alphabets"
          },
          " fixed byte classes"
        ]
      },
      {
        "desc": "exact n, or at-least n"
      },
      {
        "desc": "optional extra check"
      }
    ],
    "rows": [
      {
        "term": "Boundary",
        "body": [
          "The character just before and just after must ",
          {
            "em": "not"
          },
          " be part of the alphabet, so a slice of a longer blob is not mistaken for a whole key."
        ]
      },
      {
        "term": "Case",
        "body": "A vendor documented as lowercase hex uses a lowercase-only class, so a case-mangled lookalike is rejected rather than matched."
      },
      {
        "term": "Validator",
        "body": [
          "Confluent's keys carry a real ",
          {
            "b": "CRC-32"
          },
          " checksum tail, which the detector recomputes. Cloudflare's is only checked for being lowercase hex."
        ]
      }
    ],
    "p1": "Two vendors are quirkier than the shape allows and get hand-composed grammars:",
    "codeLabel": "OpenAI project key format",
    "code": [
      "sk-proj-",
      {
        "dim": "⟨74 chars⟩"
      },
      "T3BlbkFJ",
      {
        "dim": "⟨74 chars⟩"
      }
    ],
    "p2": [
      "That marker in the middle is ",
      {
        "code": "base64(\"OpenAI\")"
      },
      ". Every key they issue carries it, so the detector anchors on it instead of trusting ",
      {
        "code": "sk-"
      },
      " alone."
    ],
    "tradeoff": [
      {
        "b": "The tradeoff: precision."
      },
      " A brand-new key format, or a truncated one, is simply missed until someone adds its grammar."
    ]
  },
  "tier3": {
    "eyebrow": "Tier 3",
    "title": "Shapes nobody owns",
    "lede": [
      "These are general formats that no vendor owns. There are ",
      {
        "var": "structural"
      },
      " of them, and they are the only detectors the small ",
      {
        "code": "common"
      },
      " profile keeps."
    ],
    "rows": [
      {
        "term": "JWT",
        "body": [
          "Three dot-separated chunks, and the first two must start ",
          {
            "code": "eyJ"
          },
          ", the fingerprint of base64'd JSON."
        ]
      },
      {
        "term": "Bearer",
        "body": [
          {
            "code": "Bearer"
          },
          " plus at least 16 characters. ",
          {
            "b": "Only the token"
          },
          " is selected, never the header word."
        ]
      },
      {
        "term": "Connection URL",
        "body": [
          "Picks out ",
          {
            "em": "only"
          },
          " the password inside ",
          {
            "code": "postgres://user:pw@host"
          },
          ". The host stays readable."
        ]
      },
      {
        "term": "otpauth URI",
        "body": [
          "The scheme plus a ",
          {
            "code": "secret="
          },
          " parameter. The label and issuer are left alone."
        ]
      }
    ],
    "p1": [
      "There is one deliberate exception: a JWT is dropped if its payload says it is a Supabase ",
      {
        "code": "anon"
      },
      " key, which is public by design and ships in browser bundles. ",
      {
        "b": "It is the only place a token's contents are read at all."
      }
    ],
    "tradeoff": [
      {
        "b": "The tradeoff:"
      },
      " a bare TOTP seed with no ",
      {
        "code": "otpauth://"
      },
      " wrapper has no shape to key on, so it is invisible here."
    ]
  },
  "tier2": {
    "eyebrow": "Tier 2",
    "title": "The name vouches for the value",
    "lede": [
      "This is the catch-all for credentials nobody has a grammar for. It needs ",
      {
        "b": "two things to agree"
      },
      ": a name that sounds like a secret, and a value that looks like one."
    ],
    "rows": [
      {
        "term": "Name",
        "body": [
          "Case and punctuation are flattened first, so ",
          {
            "code": "apiKey"
          },
          ", ",
          {
            "code": "API-KEY"
          },
          " and ",
          {
            "code": "api.key"
          },
          " are one name."
        ]
      },
      {
        "term": "Strong names",
        "body": [
          {
            "code": "api_key"
          },
          ", ",
          {
            "code": "password"
          },
          ", ",
          {
            "code": "client_secret"
          },
          ", ",
          {
            "code": "access_token"
          },
          ": the value must score ",
          {
            "b": "3.0"
          },
          " on randomness."
        ]
      },
      {
        "term": "Maybe names",
        "body": [
          {
            "code": "auth"
          },
          ", ",
          {
            "code": "credential"
          },
          ", ",
          {
            "code": "signing_key"
          },
          ": the bar rises to ",
          {
            "b": "3.5"
          },
          ". Weaker word, stronger proof."
        ]
      },
      {
        "term": "Length",
        "body": "At least 8 characters; randomness is only measured past 16; anything over 4 KB is left to the specialists."
      },
      {
        "term": "Plain token",
        "body": [
          "The bare word ",
          {
            "code": "token"
          },
          " is deliberately ignored. Too common to mean anything."
        ]
      }
    ],
    "heading": "Then it throws most of them away",
    "p1": [
      "A large part of this detector is knowing what ",
      {
        "em": "is not"
      },
      " a secret. All of these are recognised and skipped:"
    ],
    "chipsLabel": "Values recognised and skipped",
    "p2": [
      "Every one of those is a ",
      {
        "em": "pointer"
      },
      " to a secret, not the secret. Flagging them is the fastest way to make a scanner people turn off."
    ],
    "tradeoff": [
      {
        "b": "The tradeoff:"
      },
      " this is the noisiest tier, so it is held to the strictest exclusions, and by default it only warns unless confidence is high."
    ]
  },
  "tier1": {
    "eyebrow": "Tier 1",
    "title": "Randomness is not evidence",
    "cards": [
      {
        "chip": "Not flagged",
        "body": [
          {
            "code": "a8f3k29dj4ms91x"
          },
          " alone in your text. A commit hash, an ID, a nonce, a UUID."
        ]
      },
      {
        "chip": "Flagged",
        "body": [
          {
            "code": "password=a8f3k29dj4ms91x"
          },
          ". The same string, now with something standing behind it."
        ]
      }
    ],
    "claimSub": "It only raises or lowers the bar for a tier above it. That single decision is why this library reports so few false alarms, and why a high-entropy secret with no name and no shape walks straight past.",
    "claim": "Entropy never promotes anything by itself."
  },
  "whenTiersDisagree": {
    "eyebrow": "When tiers disagree",
    "title": "Five tie-breakers, always in this order",
    "lede": [
      "Two detectors often claim overlapping text. The winner ",
      {
        "b": "does not depend on which ran first"
      },
      ". A fixed comparison runs top to bottom until something differs."
    ],
    "rows": [
      {
        "term": "1 · Severity",
        "body": [
          "A candidate that would only warn can never displace one that would block. ",
          {
            "b": "This outranks even the tier."
          }
        ]
      },
      {
        "term": "2 · Tier",
        "body": "The ladder above. Private key beats provider beats structural beats contextual beats entropy."
      },
      {
        "term": "3 · Confidence",